{
  "name": "vnkc/source-registry",
  "version": "0.1.0",
  "schema_version": "0.0.0",
  "build_timestamp": "2026-07-27T00:00:00Z",
  "description": "The VNKC candidate source registry itself, published as a dataset: 36 official Vietnamese sources across law, tax, labour, statistics, and administrative domains, tiered and license-audited.",
  "source_snapshots": [
    {
      "source_id": "manual",
      "snapshot": "2026-07-27"
    }
  ],
  "license_manifest": [
    {
      "source_id": "moj-vbpl",
      "license_status": "reference-only",
      "attribution": "Bộ Tư pháp nước CHXHCN Việt Nam — vbpl.vn"
    },
    {
      "source_id": "gov-vanban",
      "license_status": "reference-only",
      "attribution": "Cục Thông tin, Truyền thông / Văn phòng Chính phủ — ghi rõ nguồn www.chinhphu.vn"
    }
  ],
  "row_counts": {
    "sources": 36
  },
  "quality_metrics": {
    "schema_valid": "true",
    "duplicate_ids": "0",
    "verified_confidence_ratio": "0.97"
  },
  "checksums": [
    {
      "path": "registry/sources.yaml",
      "sha256": "0000000000000000000000000000000000000000000000000000000000000000"
    }
  ],
  "formats": ["jsonl", "parquet"],
  "known_limitations": [
    "Checksum is an all-zeros placeholder — real content checksums are computed by the release pipeline, which does not exist yet (Phase 0).",
    "license_manifest is an excerpt (2 of 36 sources) for illustration; a real release enumerates every source.",
    "License statuses are desk-research findings, not legal advice; see DATA_LICENSES.md."
  ],
  "intended_uses": [
    "Discovering authoritative Vietnamese data sources with provenance and licensing posture",
    "Planning ingestion pipelines for the canonical knowledge layer"
  ],
  "prohibited_uses": [
    "Legal advice or any representation that registry metadata is legally authoritative",
    "Redistributing source content under a license broader than its license_status permits"
  ]
}
